ID,Reported_On,Additional_Reporting,Retrieve_from_1,Retrieve_from_2,Retrieve_from_3,Twitter_Reference,Direct_Post_1,Direct_Post_2,Direct_Post_3,Direct_Post_4,Title,Publication_Date,Entry_Date,Country,Primary_Language,Secondary_Language,Main_Narrative,Narrative_Description,ChainMsg_or_Email,Motive,Motive_Description,Source,Source_Description,Distrib_Channel,Misinfo_Type,Key_Words,Summary,Coder
338,https://www.lemonde.fr/les-decodeurs/article/2020/03/26/coronavirus-combien-de-temps-le-sars-cov-2-reste-t-il-infectieux-sur-des-surfaces_6034549_4355770.html,,https://www.lemonde.fr/les-decodeurs/article/2020/03/26/coronavirus-combien-de-temps-le-sars-cov-2-reste-t-il-infectieux-sur-des-surfaces_6034549_4355770.html,,,0,,,,,Coronavirus : combien de temps reste-t-il infectieux sur des surfaces ?,26-Mar-20,16-Apr-20,France,French,,False cures and preventative measures,Recommendations to leave shopping bags in the car for 1h30 after doing the shopping and to clean everything that was touched by others with diluted bleach,1,Help,Excessively encourage people to take precautionary measures against coronavirus,Individual actor,General public,"Facebook, Whatsapp",Fake remedy,"Coronavirus, shopping bags, bleach, clean, leave","Messages circulating telling people it is necessary to leave shopping bags in the car for 1h30 after doing the shopping and to clean everything with diluted bleach, despite authorities carifying it is enough to keep social distance and wash hands",Giorgio
339,https://www.lemonde.fr/les-decodeurs/article/2020/03/26/non-le-maroc-n-a-pas-gueri-cinq-malades-du-coronavirus-grace-a-la-chloroquine_6034509_4355770.html,,,,,0,https://www.saharamedias.net/fr/maroc-5-malades-du-coronavirus-gueris-apres-avoir-ete-traite-a-la-chloroquine/,,,,"Non, le Maroc n’a pas guéri cinq malades du coronavirus grâce à la chloroquine",26-Mar-20,21-Apr-20,"Mauritania, France",French,,False cures and preventative measures,News article claiming 5 people in Morocco have healed from Covid-19 thanks to the use of chloroquine,0,False Hope,Spread the idea that definitive evidence for the effectiveness of chloroquine against coronavirus exists already,Media,"Mauritanian news website ""Sahara Media""","Website, Facebook",Fake remedy,"Coronavirus, chloroquine, Morocco, Mauritania, France, cure","A news website in Mauritania falsely reported that 5 people in Morocco had been treated with chloroquine and healed from coronavirus, and the news spread quickly through Facebook also in France",Giorgio
340,https://www.lemonde.fr/les-decodeurs/article/2020/03/26/non-la-france-ne-depense-pas-cinquante-fois-plus-pour-la-defense-que-pour-la-sante_6034526_4355770.html,,https://www.lemonde.fr/les-decodeurs/article/2020/03/26/non-la-france-ne-depense-pas-cinquante-fois-plus-pour-la-defense-que-pour-la-sante_6034526_4355770.html,,,0,,,,,"Non, la France ne dépense pas cinquante fois plus pour la défense que pour la santé",26-Mar-20,26-Apr-20,France,French,,Emergency responses,Rumors the French government spends 50 times more on the military then it does on the health system during the coronavirus emergency,0,Politics,Discredit the French government by spreading fake news on its decisions in terms of budget,Individual actor,General public,Facebook,False reporting,"Coronavirus, France, government, health system, budget","The news spread that the French government would spend in 2020 50 times more on the military than it does on the health system, when it actually spends much more on health",Giorgio
341,https://correctiv.org/faktencheck/2020/03/26/gefaelschter-focus-artikel-nein-die-supermaerkte-in-deutschland-schliessen-nicht-an-vier-wochentagen,,,,,0,,,,,"Gefälschter „Focus“-Artikel: Nein, die Supermärkte in Deutschland schließen nicht an vier Wochentagen",26-Mar-20,15-Apr-20,Germany,German,,Other,Rumors spread that all supermarkets in Germany would be closed except for two days a week in response to the outbreak,1,Fear,Create panic among general population ,Individual actor,General public,Whatsapp,False reporting,"Coronavirus, Germany, supermarkets, Whatsapp","Screenshot of a fake Focus article was spread on Whatsapp, claiming that all major supermarket chains in Germany would close except Mondays and Fridays in response to coronavirus",Audrey
342,https://maldita.es/malditobulo/2020/03/26/la-verdad-sobre-el-coronavirus-video-laboratorio/,,,,,0,,,,,"El bulo del vídeo sobre COVID-19 ""la verdad sobre el coronavirus"": no hay ninguna prueba de que fuese creado en un laboratorio en 2013",26-Mar-20,26-Mar-20,Spain,Spanish,,Origin of the virus ,"A video affirming that the virus was patented by the Pibright Institute, which works with the Gates Foundation, in 2014",0,Undermine target country institutions,Blame the Gates Foundation for the outbreak of the virus to discredit the institution,Individual actor,General public,Social Media ,Conspiracy,"Coronavirus, Pribright Institute, Gates Foundation, laboratorios, patente","A video circulated on different media saying that the Gates Foundation, through the Pirbright Institute, was responsible for the creation of the virus in a bio informatics laboratory in 2014.",Luca
343,https://maldita.es/malditobulo/2020/03/26/practicar-sexo-prevenga-infeccion-coronavirus/,,https://archive.li/5i1qs,,,0,https://www.facebook.com/100035189521960/videos/233344944515155/,,,,No hay pruebas de que practicar sexo al menos cada dos días prevenga la infección por coronavirus,26-Mar-20,26-Mar-20,Spain,Spanish,,False cures and preventative measures,A person saying that having sex helps mitigate the effects of the virus ,0,Other,"A video saying that having sex mitigates the effects of the virus, probably pushed for the sake of it",Individual actor,General public,Facebook,Fake remedy,"Coronavirus, relaciones sexuales, sintomas",A video circulated on Facebook filming a girl saying that having sex mitigates the symptoms resulting from the virus. ,Luca
344,https://maldita.es/malditobulo/2020/03/26/vagon-tren-covid-19-senalizacion/,,https://web.archive.org/web/20200319174939/https://www.facebook.com/photo.php,,,0,https://www.facebook.com/photo.php,,,,"El bulo del vagón de tren con la inscripción ""COVID-19""",26-Mar-20,26-Mar-20,Spain,Spanish,,Weaponization or design,"A photo showing a train in Texas with the label ""Covid-19"" and affirming that the train is carrying biological material",0,Undermine target country institutions,"The goal is to hint to the fact that the virus is a biological weapon used by the US, given that it is said the train is in Texas",Individual actor,General public,Facebook,Conspiracy,"Coronavirus, vagon cisterna, Texas, materiales biologicos","A photo was posted on Facebook showing a train with the label ""Covid-19"". The post was saying this was a train in Texas carrying some biological material. ",Luca
345,https://maldita.es/malditobulo/2020/03/27/bill-gates-carta-coronavirus-gran-corrector/,,https://maldita.es/malditobulo/2020/03/27/bill-gates-carta-coronavirus-gran-corrector/,,,1,https://twitter.com/NaomiCampbell/status/1242249022942973954,,,,"No, no hay pruebas de que Bill Gates haya escrito una carta en la que diga que el coronavirus es ""el gran corrector"" y que ""está aquí para enseñarnos unas lecciones que parece hemos olvidado""",27-Mar-20,27-Mar-20,Ambiguous,English,,Weaponization or design,"A message allegedly by Bill Gates saying that there is a spiritual reason behind the outbreak of the virus and that the virus is the ""great corrector""",1,Politics,The goal is to discredit Bill Gates by making him appear to say absurd statements,Individual actor,General public (,"Twitter, WhatsApp, other social media","Conspiracy, False reporting","Coronavirus, Bill Gates, propósito espiritual, gran corrector","A message was shared, saying it was by Bill Gates, saying that there is a spiritual reason behind the outbreak of the virus and that the virus is the ""great corrector"" and will teach us somethign we appear to have forgotten",Luca
346,https://www.rappler.com/newsbreak/fact-check/256069-coronavirus-vaccine-ready-cure-within-hours,,https://www.rappler.com/newsbreak/fact-check/256069-coronavirus-vaccine-ready-cure-within-hours,,,0,,,,,"FALSE: Coronavirus vaccine ready, can cure within 3 hours",27-Mar-20,1-Apr-20,Philippines,English,Tagalog,False cures and preventative measures,Facebook post with a photo of a supposed COVID-19 vaccine ready. ,0,False Hope,"Attempts to spread a Facebook photo claiming the existence of a vaccine, for the sake of it.",Individual actor,General public,Facebook,Fake remedy,"Coronavirus, Facbeook, vaccine, Philippines, Roche medical company","Facebook post sharing a ""working vaccine"" for COVID-19 spread in the Philippines.",Jan
347,https://www.altnews.in/no-indian-army-has-not-built-1000-bed-quarantine-facility-for-coronavirus-patients/,,https://www.altnews.in/no-indian-army-has-not-built-1000-bed-quarantine-facility-for-coronavirus-patients/,,,1,https://www.facebook.com/search/posts/?q=Bedekar%20Col%3A%20A%20thousand%20bed%20hospital%20created%20by%20the%20Army%20in%20Barmer%2C%20Rajasthan..&f=AbqTc_hlfKYzcHV_FAR-qTCEoleItozS2-CPvYhez8zz3XJUr8YGaL1oMRMEYxsw7d2TuOVbhNIfKG2BFrLlqbsqGbhoOvi9td9lD3Nv3iyJ_eb0ZwAbawhH2aHRkwnRciZ23hTDIzVMVfuyTnRlJH8LCO80q-AKXQG_leYo9XRLtFUVLE_rX__z65EAI8EDYMtysto-u6wB53ohnhhWHPFUe7D4OFrSS4ZJykVuHntXgA&filters=eyJycF9hdXRob3IiOiJ7XCJuYW1lXCI6XCJtZXJnZWRfcHVibGljX3Bvc3RzXCIsXCJhcmdzXCI6XCJcIn0ifQ%3D%3D,,,,"No, Indian army has not built 1000-bed quarantine facility for coronavirus patients",27-Mar-20,14-Apr-20,India,English,,Emergency responses,The Indian army built a 1000-bed quarantine facility in Rajasthan,0,False Hope,Makes people believe that the army can build emergency quarantine facilities for the coronavirus,Individual actor,General public,"Twitter, Facebook",False reporting,"Coronavirus, army, quarantine facilities","Images were circulating on Twitter and Facebook of a quarantine facility in Rajasthan built by the Indian army but were actually images from elsewhere around the world, unassociated with the coronavirus",Kamya
348,https://www.boomlive.in/fake-news/scene-from-mini-series-pandemic-peddled-as-coronavirus-mass-grave-7396,,https://www.boomlive.in/fake-news/scene-from-mini-series-pandemic-peddled-as-coronavirus-mass-grave-7396,https://www.boomlive.in/fake-news/did-a-netflix-show-predict-the-covid-19-outbreak-7398,,0,https://www.facebook.com/bilalchopra/videos/3146856318660086/,https://www.facebook.com/sriman.narayan.319/videos/2677118322386908/,,,Scene From Mini-Series Pandemic Peddled As Coronavirus Mass Grave,27-Mar-20,24-Apr-20,India,English,,Other,Mass graves found in Italy due to the deaths from coronavirus,0,Fear,Stoke fear among people,Individual actor,General public,Facebook,False reporting,"Coronavirus, pandemic, mass graves, Italy","Videos from a mini-series, Pandemic, were shared through Indian social media accounts as evidence of mass graves in Italy",Kamya
349,https://www.liberation.fr/checknews/2020/03/27/pourquoi-l-entreprise-italienne-svecom-a-remplace-le-drapeau-europeen-par-celui-de-la-chine_1783263,,https://www.liberation.fr/checknews/2020/03/27/pourquoi-l-entreprise-italienne-svecom-a-remplace-le-drapeau-europeen-par-celui-de-la-chine_1783263,,,1,,,,,Pourquoi l'entreprise italienne Svecom a-t-elle remplacé le drapeau européen par celui de la Chine ?,27-Mar-20,12-Apr-20,France,French,,Other,Claims that people in Italy are replacing EU flags with Chinese ones to both thank China and insult the EU,0,Politics,"Discredit the EU and claim that it is not helping against coronavirus, while China is",Individual actor,Twitter accounts,Twitter,False reporting,"Coronavirus, Italy, flag, Svecom, EU, China","Rumors spread that Italians were replacing EU flags with Chinese ones to insult the EU for lack of help, based on the fact that one firm did so (the firm clarified it was just to thank China for its help, with no other reason)",Giorgio
350,https://correctiv.org/faktencheck/2020/03/27/video-einer-frau-in-italien-schuert-panik-mit-ueberspitzten-behauptungen-ueber-das-coronavirus,,http://archive.is/AZB4r,,,0,,,,,Video einer Frau in Italien schürt Panik mit überspitzten Behauptungen über das Coronavirus,27-Mar-20,14-Apr-20,Germany,German,,Nature of the virus,"Advice spread that when coming indoors, you should take your clothes off outside and immediately wash them to prevent bringing the coronavirus in",1,Fear,"Overexaggeration of methods needed to stay safe, exaggerates properties of the virus",Individual actor,German woman in Italy,"Whatsapp, Facebook",False reporting,"Coronavirus, Germany, Italy, disinfectant, clothing",Woman in Italy claims to be giving tips to the German population to wash all clothing immediately if outdoors because coronavirus can spread through wind and can stay on surfaces for 9 hours,Audrey
351,"https://www.br.de/nachrichten/netzwelt/coronavirus-fakes-und-faktenchecks,Ros6PIg",,,,,0,,,,,Intervallfasten gegen Coronaviren? Ein “Ammenmärchen!”,27-Mar-20,24-Apr-20,Germany,German,,False cures and preventative measures,Claims spread that intermittent fasting can clear the coronavirus from your body,1,False Hope,Make it seem easier to cure the coronavirus than it actually is,Individual actor,General public,Whatsapp,Fake remedy,"Coronavirus, Germany, fasting, Whatsapp","Whatsapp chain letter circulated, which says that if you have coronavirus you can fast at intervals and that will clear the virus ",Audrey
352,https://www.open.online/2020/03/27/coronavirus-la-falsa-sintesi-della-johns-hopkins-university-che-circola-su-whatsapp/,,https://www.open.online/2020/03/27/coronavirus-la-falsa-sintesi-della-johns-hopkins-university-che-circola-su-whatsapp/,,,0,,,,,Coronavirus. La falsa sintesi della Johns Hopkins University che circola su Whatsapp,27-Mar-20,1-Apr-20,Italy,Italian,,Nature of the virus,A message was spread on WhatsApp saying that John Hopkins University found out tha the virus is in truth  DNA and not RNA,1,Other,"A message saying that John Hopkins found out that the virus is not RNA but DNA, maybe to create confusion among people",Individual actor,General public,WhatsApp,False reporting,"Coronavirus, John Hopkins University, RNA","A message was spread on WhatsApp saying that John Hopkins discovered that the virus is not RNA but rather DNA, maybe to create confusion among people. ",Luca
353,https://www.kwongwah.com.my/20200327/%E3%80%90%E8%A1%8C%E7%AE%A1%E7%AC%AC10%E5%A4%A9%E3%80%91-%E6%95%A3%E6%92%AD%E6%96%B0%E5%86%A0%E7%97%85%E6%AF%92%E5%81%87%E6%B6%88%E6%81%AF-%E7%94%B7%E5%AD%90%E8%A2%AB%E7%BD%9A2%E5%8D%83/,,https://www.kwongwah.com.my/20200327/%E3%80%90%E8%A1%8C%E7%AE%A1%E7%AC%AC10%E5%A4%A9%E3%80%91-%E6%95%A3%E6%92%AD%E6%96%B0%E5%86%A0%E7%97%85%E6%AF%92%E5%81%87%E6%B6%88%E6%81%AF-%E7%94%B7%E5%AD%90%E8%A2%AB%E7%BD%9A2%E5%8D%83/,,,0,,,,,????10?? ????????? ????2?,27-Mar-20,4-Apr-20,China,Mandarin,,Other,A man who spread false information on Coronavirus was trialed and fined 2000 rmb. ,0,Fear,Spread claim that father was not willing to get tested for the Coronavirus,Individual actor ,Arias ,WhatsApp,False reporting,"Coronavirus, Fine, China, Ttham Radio",Self employed man reports that his father does not want to get tested for Coronavirus after returning from mission trip,Anne
354,https://maldita.es/malditobulo/2020/03/27/leones-leon-rusia-libera-coronavirus-calle/,,https://maldita.es/malditobulo/2020/03/27/leones-leon-rusia-libera-coronavirus-calle/,,,0,,,,,"No, Putin no ha liberado a 700 leones para mantener a la gente en sus casas por el coronavirus: es una imagen de 2016 en Sudáfrica",27-Mar-20,27-Mar-20,Ambiguous,Spanish,English,Emergency responses,A photo showing lions in the street and the post claiming that Putin unleashed them to keep people in their houses,0,Undermine target country institutions,The goal is to discredit the Russian government accusing it to do an absurd policy against its citizens,Individual actor,General public,Social Media ,False reporting,"Coronavirus, Putin, gobierno ruso, leones","A photo circulated on social media showing lions in the streets and saying these were unleashed by Putin to keep people in their houses. However, the photo was real and was taken in 2016 in Johannesburg, South Africa. ",Luca
355,https://maldita.es/malditobulo/2020/03/27/pruebas-nuevo-brote-coronavirus-creado-laboratorios-video/,,,,,1,https://www.youtube.com/watch,https://mobile.twitter.com/RubyDemestoy/status/1242640189383729154,,,Ni hay pruebas de que el brote del nuevo coronavirus haya sido creado en un laboratorio ni los coronavirus en humanos son recientes,27-Mar-20,27-Mar-20,Spain,Spanish,,Weaponization or design,A video in which a girl affirms that the virus was patented by the Pirbright Institute in 2014 (linked to the Gates Foundation),0,Undermine target country institutions,The goal is to discredit the Gates Foundation in the United States,Individual actor ,"General public (@RubyDemestoy on Twitter)
","Twitter, Youtube",Conspiracy,"Coronavirus, Pirbright Insitute, laboratorios, bioinformatica",A video in which a girl affirms that the virus was patented in 2014 by the Pirbright Institute (linked to the Gates Foundation) and claiming that the outbreak was a planned biological attack. ,Luca
356,https://user.guancha.cn/main/content?id=273449&s=fwtjgzwz,,,,,0,,,,,????????????????????,28-Mar-20,5-Apr-20,China,Mandarin,,Origin of the virus,NIH blog claims the source of the virus is nature,0,Undermine target country institutions ,Spread false claims of the source of the virus,Individual actor,Francis Collins Blogger,Blog,Conspiracy,"Coronavirus, Francis Collins, Nature, NIH Director, Genomic study",NIH Director publishes blog post that claims genomic study points to the natural origin of the virus,Anne
357,https://www.abante.com.ph/mayor-online-vlogger-kinasuhan-sa-pekeng-covid-19-result.htm,,,,,0,,,,,"Mayor, online vlogger kinasuhan sa pekeng Covid-19 result",28-Mar-20,29-Mar-20,Philippines,Tagalog,,COVID-19 status of individuals,"Mayor of a town in Cavite, PH associated with spreading false information about COVID-19 related patients and deaths.",0,Fear,"Mayor and ""vloggers"" spreading misinformation about patients and deaths for the sake of it.",Individual actor,Noveleta Mayor Dino Reyes Chua,"Facebook, Youtube",False reporting,"Coronavirus, Noveleta Mayor Dino Reyes Chua, Philippines", Noveleta Mayor Dino Reyes Chua and vloggers under fire for purposely spreading false reports of COVID-19 related patients and deaths in their town.,Jan
358,https://twitter.com/WorldVivid/status/1244120170962071552,,,,,1,https://twitter.com/WorldVivid/status/1244120170962071552,,,,"According to Prof. Robert Garry from Tulane University, “Wuhan wasn’t the origin of the virus”.",29-Mar-20,5-Apr-20,US,English,,Nature of the virus,Twitter user claims Professor Robert Garry from Tulane University said Wuhan wasn't the origin of the virus,0,Fear,Spread false claim that Wuhan wasn't the origin of the virus,Individual actor,Twitter user,Twitter,Conspiracy,"Coronavirus, Tulane University, Wuhan, origin, Professor",Twitter user claims Professor Robert Garry from Tulane University said Wuhan wasn't the origin of the virus,Anne
359,https://euvsdisinfo.eu/report/380-belgians-caught-covid-19-through-a-massive-act-of-group-sex/,,,,,0,http://zavtra.ru/blogs/380_chelovek_zarazilis_covid-19_v_bel_gii_vo_vremya_massovogo_gruppovogo_seksa,,,,DISINFO: 380 BELGIANS CAUGHT COVID-19 THROUGH A MASSIVE ACT OF GROUP SEX,29-Mar-20,7-Apr-20,Russia,Russian,Georgian,Other,False news spread about 380 Belgians supposedly catching the coronavirus through group sex,0,Politics,Garner negative public opinion towards Belgium,Media,Newspaper Zavtra,Online news website,False reporting,"Coronavirus, Belgium, Russia",Russian extreme right newspaper unironically republishes formerly debunked claims that hundreds of Belgians caught the coronavirus through massive orgy,Audrey
360,https://twitter.com/vinaycgowda62/status/1244302672548605955,,https://twitter.com/vinaycgowda62/status/1244302672548605955,,,1,https://twitter.com/vinaycgowda62/status/1244302672548605955,,,,Don’t panic. This will suddenly vanish. A little more patience needed. ,30-Mar-20,5-Apr-20,US,English,,Nature of the virus,Twitter user claims the virus will disappear,0,Downplay Severity,Spread false claims that the virus will just disappear,Individual actor,Twitter user,Twitter,Conspiracy,"Coronavirus, Sylvia Browne, End of Days, Predictable, Vanish","Twitter user claims the virus will vanish with a little more patience as predicted in the Sylvia Browne book, End of Days",Anne
361,https://smhoaxslayer.com/did-a-man-in-goa-come-up-with-an-innovative-way-to-make-people-stay-indoors/,,https://smhoaxslayer.com/did-a-man-in-goa-come-up-with-an-innovative-way-to-make-people-stay-indoors/,,,1,https://twitter.com/JioNews/status/1244555712488968198,https://twitter.com/smitaprakash/status/1244114639136477185,https://twitter.com/IndiaToday/status/1244162176186609664,https://twitter.com/rahulkanwal/status/1244256602825220096,Did a man in Goa come up with an innovative way to make people stay indoors ?,30-Mar-20,14-Apr-20,India,English,,Other,A man dressed in a ghost costume in Goa was scaring people into going back into their homes,0,Other,Spreading ridiculous news for the sake of it,Media,"India Today, Smita Prakash (from Asian News International), Rahul Kanwal, JioNews",Twitter,False reporting,"Coronavirus, Goa","Media houses and journalists falsely retweeted a video that they claimed was from Goa, India about a man pranking people into going back into their homes during the lockdown",Kamya
362,https://africacheck.org/fbcheck/not-all-these-south-african-coronavirus-lockdown-procedures-correct-use-official-regulations-instead/,,,,,0,https://www.facebook.com/permalink.php?story_fbid=2872578082835735&id=162882273805343&__tn__=-R,,,,Not all these South African coronavirus ‘lockdown procedures’ correct – use official regulations instead,30-Mar-20,22-Apr-20,South Africa,English,,Emergency responses,"South Africa imposing strict rules during lockdown, violation will result in ""instant arrest""",0,Fear,Claim that the government has imposed various strict lockdown restrictions,Individual actor,BKA Boere Krisis Aksie,Facebook,False reporting,"Coronavirus, South Africa, lockdown, arrest","A Facebook post shared over 2,000 times listed seven restrictions under South Africa's lockdown and claimed that violation would result in instant arrest; only some of the procedures were accurate",Julia
363,https://www.lemonde.fr/les-decodeurs/article/2020/03/30/non-les-vacances-scolaires-n-ont-pas-ete-reportees-au-31-juillet_6034906_4355770.html,https://factuel.afp.com/faux-cette-lettre-du-ministre-de-leducation-annoncant-le-report-des-vacances-dete-est-un-pastiche,https://perma.cc/Y2LG-HTL8,,,0,,,,,"Non, les vacances scolaires n’ont pas été reportées au 31 juillet",30-Mar-20,16-Apr-20,France,French,,Emergency responses,Claims schools in France will postpone summer vacation to make up for wasted time during the coronavirus emergency,0,Other,"Spread the news that schools will be open in summer, with delayed summer vacation, to make up for lost time",Individual actor,General public,Facebook,False reporting,"Coronavirus, France, summer, holiday, schools","The news spread (through a fake ""official document"" by the Ministry of Education) that French schools would postpone summer holiday to the end of July as a way to make up for lost time during the coronavirus emergency",Giorgio
364,"https://www.br.de/nachrichten/netzwelt/coronavirus-fakes-und-faktenchecks,Ros6PIg",,,,,1,,,,,"Schwarzer Patient in Italien nicht behandelt - Video ein Jahr alt, keine Verbindung zu Corona",30-Mar-20,24-Apr-20,Germany,German,English,Other,Video spread on internet of African man apparently with coronavirus refused treatment in Italy,0,Politics,Paint an image of coronavirus heightening racial tensions in Italy,Individual actor,General public,Twitter,False reporting,"Coronavirus, Italy, racism, Twitter",Video circulated on Twitter that depicts an African man who allegedly has coronavirus refused treatment at a hospital in Italy - the video is not fake but it is a year old and not about coronavirus,Audrey
365,https://www.japantimes.co.jp/news/2020/03/30/national/coronavirus-disinformation-april-fools-day/,,,,,0,,,,,Tokyo firm urges caution against surge in coronavirus-related disinformation on April Fools' Day,30-Mar-20,30-Mar-20,Japan,Japanese,,Emergency responses,Warning of disinformation spread on Japanese social media platforms about fake government responses (i.e. Tokyo on lockdown),0,Fear ,"Rumours spread on Japanese social media that Tokyo (or the entire country) will be on lockdown, to stoke fear",Individual actor,General public,social media ,False reporting,"Coronavirus, Tokyo, Japan, Lockdown, Abe",Reports of increased detection of rumours and disinformation spread on Japanese social media platforms that Tokyo (or Japan in general) will be going into lockdown.,Jan
366,https://www.buzzfeed.com/jp/kotahatachi/tokyo-lockdown-2,,,,,0,,,,,"?4?1???????????????????LINE????”???""????????????",30-Mar-20,3-Apr-20,Japan,Japanese,,Emergency responses,Chain messages warning of a national lockdown starting April 1,1,Fear,Spread claim that a lockdown will begin on April 1,Individual actor,General public,LINE,False reporting,"Coronavirus, lockdown, Japan??????????????????????fuusa, rokkudaun",LINE chain message claiming they have information from embassies and broadcasters that a nationwide lockdown will begin on April 1,Fumika
