ID,Reported_On,Additional_Reporting,Retrieve_from_1,Retrieve_from_2,Retrieve_from_3,Twitter_Reference,Direct_Post_1,Direct_Post_2,Direct_Post_3,Direct_Post_4,Title,Publication_Date,Entry_Date,Country,Primary_Language,Secondary_Language,Main_Narrative,Narrative_Description,ChainMsg_or_Email,Motive,Motive_Description,Source,Source_Description,Distrib_Channel,Misinfo_Type,Key_Words,Summary,Coder
178,https://www.npr.org/2020/03/11/814550474/missouri-sues-televangelist-jim-bakker-for-selling-fake-coronavirus-cure,,,,,0,,,,,Missouri Sues Televangelist Jim Bakker For Selling Fake Coronavirus Cure,11-Mar-20,16-Mar-20,US,English,,False cures and preventative measures,"Televangelist Jim Bakker selling a ""silver solution"" to thwart COVID-19. ",0,Profit,"Jim Bakker wanting to profit over false ""silver solution"" cures.",Individual actor,Jim Bakker,Media,Fake remedy,"Coronavirus, Jim Bakker, cure","Fake treatment (""Silver Solution"") from televangelist that can cure COVID-19.",Jan
179,https://www.miaminewtimes.com/news/coronavirus-norwegian-cruise-line-leaked-emails-show-booking-strategy-11590056,,,,,0,,,,,Leaked Emails: Norwegian Pressures Sales Team to Mislead Potential Customers About Coronavirus,11-Mar-20,16-Mar-20,US ,English,,False cures and preventative measures,Warm weather will kill the virus.,0,Profit,"Norwegian Cruise Line sending an email to their employees, to tell passengers that warm weather will kill the virus to profit.",Companies,Norwegian Cruise Line,Email,False reporting,"Coronavirus, cruises, warm weather","Email chain among cruise employees, suggesting warm weather kills the virus. ",Jan
180,https://www.facebook.com/realUpsetCalifornianConservative/posts/2648766678715989,,,,,0,https://www.facebook.com/realUpsetCalifornianConservative/posts/2648766678715989,,,,Facebook post: Coronavirus and Impeachment,11-Mar-20,16-Mar-20,US ,English,,Weaponization or design,"Facebook post saying COVID-19 is a Democrat run, impeachment plot against President Trump.",0,Politics,"Facebook post trying to help Trump's political standing, by posing COVID-19 as part of the Democrats' impeachment efforts.",Individual actor,General public,Facebook,Conspiracy,"Coronavirus, impeachment, Democrats",Facebook post that COVID-19 scare started right after impeachment failed. ,Jan
181,https://africacheck.org/fbcheck/south-africas-first-coronavirus-patient-now-has-no-symptoms-but-not-cured/,,,,,0,,,,,"South Africa’s first coronavirus patient now has no symptoms, but not ‘cured’",11-Mar-20,22-Apr-20,South Africa,English,,COVID-19 status of individuals,South Africa has cured its first patient,0,False Hope,South Africa's first patient is cured and national health situation may be improving,Media,iHarare,News website,False reporting,"Coronavirus, South Africa, cure",An article by iHarare claimed that South Africa had 'cured' its first patient and this story was subsequently spread on Facebook; the patient has demonsntrated no symptoms but is not reported cured,Julia
182,https://www.facebook.com/SadafAmiri.afg/photos/a.291491181667685/652512245565575/?type=3&theater,,,,,0,,,,,????? ?????-???? ????? ????-???? ????????? ?????,11-Mar-20,12-Apr-20,Afghanistan,Farsi,,Other,Corona Virus-The collaborative killing weapon-made by the Biolab-level4 laboratory,,Undermine target country institutions ,A wrong information describes that for which purposes USA created covid19?,Individual actor,General public,Facebook,Conspiracy,"Corona Virus, HIV, USA, China, Iran, Economic Break Down, Generation Genocide, Bio-Weapon",An information which describes that corona virus is the fabrication of west for damaging the economic of east and the generation of Asia,Shahim
183,https://www.open.online/2020/03/11/coronavirus-laudio-whatsapp-di-martina-la-cardiologa-di-milano-false-notizie-denunciata/,,https://archive.is/a7u8G,,,0,https://www.dagospia.com/rubrica-29/cronache/ldquo-abbiamo-mila-ventilatori-polmonari-italia-se-10mila-avessero-229349.htm    ,,,,"Coronavirus. L’audio Whatsapp di Martina, la cardiologa di Milano. False notizie! Denunciata!",11-Mar-20,18-Mar-20,Italy,Italian,,Emergency responses,Niguarda Hospital in Milan will leave patients to die due to limited capacity,1,Fear,Spread fear about insufficient capacity of healthcare facilities,Individual actor,General public,"WhatsApp, Website, News",False reporting,"Coronavirus, Martina, Niguarda, cardiologa, Il Giornale",Two Whatsapp audio messages (one by self-proclaimed cardiologist named 'Martina') spread fake news on the reduced capacity of Milanese Niguarda Hospital and on the fact that doctors would soon start leaving people to die. The content of the messages was reported without any check on website 'Dagospia' and newspaper 'Il Giornale' without any check. The authors of the messages were reported to the police by the Hospital.,Nicola
184,https://www.buzzfeed.com/jp/kotahatachi/unknown-cause-china-20,,,,,1,,,,,NHK?????????????????????????????????????…,11-Mar-20,4-Apr-20,Japan,Japanese,,Other,"Tweets claiming that NHK China has called the coronavirus the ""Japanese coronavirus""",0,Politics,"Spread claim that NHK China is reporting the coronavirus as ""the Japanese virus"" ",Individual actor,Manga artist Koubun Sun,Twitter,False reporting,"Coronavirus, Japan, NHK China, Japanese virus, manga artist, Koubun Sun","Twitter user Koubun Sun falsely claimed that NHK Chinese version reported the coronavirus as the ""Japanese virus""",Fumika
185,http://news.southcn.com/nfplus/nftz/content/2020-03/11/content_190559981.htm,,http://news.southcn.com/nfplus/nftz/content/2020-03/11/content_190559981.htm,,,0,,,,,?????????????????????????,11-Mar-20,11-Apr-20,China,Mandarin,,False cures and preventative measures,Water with soap can decrease chances of getting the coronavirus,1,Help,Spreads false claims that water with soap can decrease chances of getting the coronavirus,Individual actor,"General public, Chongqing Internet Believer",Social media,Fake remedy,"Coronavirus, Chongqing Internet Believer, soap, water","Rumors were spread the soap with water will decrease chances of getting the coronavirus, but the Chongqing Internet Believer debunked the claims",Anne
186,http://news.southcn.com/nfplus/nftz/content/2020-03/11/content_190559981.htm,,,,,0,,,,,?????????????????????????,11-Mar-20,11-Apr-20,China,Mandarin,,False cures and preventative measures,Burning face masks can tell whether or not they are real or fake face masks,1,Help,Spreads false claims that burning face masks can tell whether or not they are real or fake,Individual actor,General public,Social media,Conspiracy,"Coronavirus, burning, face masks",Rumors were spread that burning the face masks can tell whether or not they are real or fake,Anne
187,https://medium.com/dfrlab/maduros-attempt-to-exploit-coronavirus-outbreak-backfires-on-social-media-eef39326e940,,,,,1,https://mazo4f.com/de-que-vuelan-vuelan-maduro-pide-investigar-si-el-coronavirus-es-un-arma-de-guerra-del-imperialismo, https://twitter.com/ConElMazoDando/status/1233477738851381253, https://twitter.com/Lechuguinos_com/status/1234281031299215360,https://www.lechuguinos.com/coronavirus-arma-imperialismo/,Maduro’s attempt to exploit coronavirus outbreak backfires on social media,11-Mar-20,21-Mar-20,Venezuela,Spanish,,Weaponization or design,Maduro and regime's number two Cabello declaring Covid-19 was a US bio-plot to slow down Chinese economic growth.,0,Undermine target country institutions ,"The Venezuelan government blames the US for the Covid-19 outbreak to undermine the US internationally and side with its historical ally, China.","Political actor, media ","Nicolas Maduro, Diosdado Cabello (the regime's number two), ""Con el Mazo Dando"" (TV show), Lechuginos (media outlet)","In person, Twitter, Website, Facebook",Conspiracy,"Coronavirus, US, biological warfare","Venezuelan President Maduro and the regime's number two Cabello declared that Covid-19 was a biological attack pushed by the US and western allies to slow down Chinese economic growth. This thought was then spread by some famous TV shows websites, or media outlets. ",Luca
188,https://twitter.com/FreddiGoldstein/status/1238188241968336903,,,,,1,https://twitter.com/FreddiGoldstein/status/1238188241968336903,,,,Tweet: False chain message about NYPD containment actions,12-Mar-20,16-Mar-20,US,English,,Emergency responses,Chain message of NYPD containment responses. ,1,Fear,Chain message spread to stoke fear among Americans through WhatsApp/SMS messages.,Individual actor,General public,"Media, SMS",False reporting,"Coronavirus, NYPD, containment zone",Tweet with a screenshot of chain message suggesting NYPD will implement containment actions,Jan
189,https://qz.com/1816973/amazon-is-selling-coronavirus-misinformation/,,https://qz.com/1816973/amazon-is-selling-coronavirus-misinformation/,,,0,,,,,Amazon is selling coronavirus misinformation,12-Mar-20,16-Mar-20,US,English,,False cures and preventative measures,Prayer and self-help books to prevent getting COVID-19.,0,Profit,"Sellers on Amazon wanting to profit off of ""prayer and self-help books against COVID-19""",Companies,Amazon Sellers,Amazon,Fake remedy,"Coronavirus, Amazon, cures, prayers","Books on Coronavirus cures being sold on Amazon. For example: ""Warfare Prayers Against the Coronavirus"" or "" Holistic Help for the Coronavirus""",Jan
190,https://apnews.com/afs:Content:8635070312,,,,,0,,,,,Ability to hold your breath 10 seconds is not a test for coronavirus,12-Mar-20,16-Mar-20,US,English,,False diagnosis procedures,Chain message of breathing exercises to know if you have COVID-19.,1,Other,Efforts to spread false diagnostic procedures among WhatsApp users.,Individual actor,General public,"Facebook, Twitter, WhatsApp",Fake remedy,"Coronavirus, hold breath, Taiwan, Japanese doctors, Stanford","False claim that ""holding your breath for 10 seconds proves there's no infection in your lungs"" attributed to Japanese and/or Taiwanese scientists, and experts at Stanford.",Jan
191,https://www.newsweek.com/conservative-pastor-claims-he-healed-viewers-coronavirus-through-their-tv-screens-1492044,,,,,1,https://twitter.com/RightWingWatch/status/1238110096334479364,,,,CONSERVATIVE PASTOR CLAIMS HE 'HEALED' VIEWERS OF CORONAVIRUS THROUGH THEIR TV SCREENS,12-Mar-20,16-Mar-20,US,English,,False cures and preventative measures,Televangelist Kenneth Copeland healing people through TV screens.,0,Profit,"Kenneth Copeland wanting to profit off of his televised show, claiming he can heal. ",Individual actor,Kenneth Copeland,Media,Fake remedy,"Coronavirus, Kenneth Copeland, cure, television","Televangelist claiming to ""heal"" people from COVID-19 through television.",Jan
192,https://thehill.com/policy/international/487308-china-pushing-conspiracy-theory-us-army-bringing-coronavirus-wuhan,,,,,1,https://twitter.com/zlj517/status/1238111898828066823,,,,"China, pushing conspiracy theory, accuses US Army of bringing coronavirus to Wuhan",12-Mar-20,16-Mar-20,China,English,,Weaponization or design,US Army brought COVID-19 to Wuhan,0,Undermine target country institutions ,Chinese officials trying to weak and discredit the US Army.,State sponsors,China,Twitter,Conspiracy,"Coronavirus, China, US bioweapons",Pro-Chinese actors suggseting the US bought the virus to Wuhan.,Jan
193,https://www.globalresearch.ca/in-a-europe-closed-down-by-the-coronavirus-the-eu-opens-its-doors-to-the-us-army/5706133,,,,,0,,,,,In a Europe Closed Down by the Coronavirus the EU Opens its Doors to the US Army. Could the Defender become the Invader of Europe?,12-Mar-20,18-Mar-20,EU,English,,Emergency responses,Claims of US using COVID-19 as a path to invade the EU,0,Fear,"Global Research website portraying the US as an invader to the EU amidst the pandemic, to stoke fear.",Media,Global Research Website,Website,"Conspiracy, False reporting","Coronavirus, Europe, US, soldiers","Fake news website - with a Canadian domain - pushing story that the US is ""invading the EU"" in the midst of the COVID-19 outbreak.",Jan
194,https://www.miamiherald.com/news/nation-world/national/article241171546.html,,https://blog.reasonsecurity.com/2020/03/09/covid-19-info-stealer-the-map-of-threats-threat-analysis-report/,,,0,,,,,"Hackers made their own coronavirus map to spread malware, feds warn",13-Mar-20,16-Mar-20,US,English,,Emergency responses,"Online map which installs malware, impersonating JHU personnel. ",1,Profit,Website which installs malware trying to profit of fof viewers.,Individual actor,General public,Website,False reporting,"Coronavirus, maps, malware","Hackers linking to a false COVID-19 heatmap, installing malware. ",Jan
195,https://hoax-alert.leadstories.com/3471905-Fact-Check-Supermarkets-Are-NOT-Recalling-Coronavirus-Infected-Toilet-Paper.html,,,,,0,https://www.facebook.com/groups/ForgetTheUpsetAndLaugh/permalink/626225641261311/,,,,Fact Check: Supermarkets Are NOT Recalling Coronavirus-Infected Toilet Paper,13-Mar-20,16-Mar-20,US ,English,,Nature of the virus,Toilet paper recalled because the virus can stick to it.,0,Fear,Efforts to spread false claims that COVID-19 was on toilet paper imported from China.,Individual actor,General public,Facebook,False reporting,"Coronavirus, toilet paper, China","Toilet paper rolls imported from China were ""infected"" with COVID-19 and were being recalled in stores.",Jan
196,https://www.mediamatters.org/coronavirus-covid-19/fox-guest-jerry-falwell-jr-speculates-north-korea-got-together-china-create,,,,,0,,,,,Fox guest Jerry Falwell Jr. speculates that North Korea “got together with China” to create coronavirus,13-Mar-20,16-Mar-20,US ,English,,Weaponization or design,Jerry Falwell Jr. saying COVID-19 was a joint effort by China and North Korea,0,Politics,Jerry Falwell Jr. blaming and trying to weaken and discredit Chinese and North Korean states.,Individual actor,Jerry Falwell Jr.,Media,Conspiracy,"Coronavirus, Fox news, Jerrey Falwell, North Korea, China",Fox news guest suggesting COVID-19 was planned by North Korea and China.,Jan
197,https://edition.cnn.com/2020/03/13/us/dean-koontz-novel-coronavirus-debunk-trnd/index.html,,,,,1,https://twitter.com/NickHintonn/status/1228896027987660800,,,,"No, Dean Koontz did not predict the coronavirus in a 1981 novel",13-Mar-20,18-Mar-20,US ,English,,Origin of the virus,Author Dean Koontz allegedly predicted COVID-19 in his 1981 novel.,0,Other,Efforts to create a link between Dean Koontz' book predicting the virus.,Individual actor,General public,Twitter,Conspiracy,"Coronavirus, Dean Koontz, Wuhan-400",Tweet suggesting an author predicted the virus in a 1981 novel.,Jan
198,https://www.nytimes.com/2020/03/13/world/asia/coronavirus-china-conspiracy-theory.html,,,,,1,https://twitter.com/zlj517/status/1238269193427906560,,,,China Spins Tale That the U.S. Army Started the Coronavirus Epidemic,13-Mar-20,20-Mar-20,China,English,,Weaponization or design,The US Army spread the virus on purpose when visiting Wuhan in October 2019,0,Undermine target country institutions ,A Chinese official effort to undermine the US government in the international arena,Political actor,Zhao Lijian ,Twitter,Conspiracy,"Coronavirus, US, China, origin","The twitter account of Zhao Lijian, @zlj517, a ministry spokesman, spread tweets sharing links on the US Army spreading the virus on purpose. This, according to the NYT, is part of  Chinese officials' action to blame the US in order to cover their wrongdoings during the first period after the outbreak. ",Luca
199,https://www.gulftoday.ae/culture/2020/03/13/book-predicted-virus-says-kim-kardashian,,,,,0,,,,,"Book predicted outbreak of coronavirus, says Kim Kardashian",13-Mar-20,5-Apr-20,US,English,,Nature of the virus,Kim Kardashian says a book predicted the virus,0,Fear,Spreads false claim that book predicted coronavirus,Individual actor,Kim Kardashian,Twitter,Conspiracy,"Coronavirus, book, prediction, Kim Kardashian",Kim Kardashian tweeted that a book predicted the coronavirus,Anne
200,https://www.liberation.fr/checknews/2020/03/13/des-centaines-de-familles-italiennes-sont-elles-parties-en-afrique-pour-fuir-le-covid-19_1781275,,,,,1,https://twitter.com/237online/status/1236951127502938112,https://www.237online.com/coronavirus-apeures-les-italiens-fuient-vers-lafrique/,http://www.24jours.com/des-centaine-de-migrants-italiens-en-route-vers-lafrique-pour-fuir-le-coronavirus/,,Des «centaines de familles» italiennes sont-elles parties en Afrique pour fuir le Covid-19 ?,13-Mar-20,12-Apr-20,France,French,,Other,Rumor that many Italians are traveling to Africa to escape coronavirus,0,Other,Spread the idea that the situation in Italy is so tragic that its population is massively leaving the country,Media,24Jours and 237online ,"Websites, Twitter, Facebook",False reporting,"Coronavirus, Italy, Africa, flee, emergency","2 media websites spread the rumor that many Italians were fleeing to Africa as a result of the coronavirus emergency, despite no supporting evidence",Giorgio
201,"https://www.br.de/nachrichten/wissen/die-gesammelten-fakes-desinformation-zu-corona,RuuURMo",,,,,0,,,,,Desinformation: Verwendung der Risikoanalyse von 2012,13-Mar-20,22-Apr-20,Germany,German,,Nature of the virus,"Statistics spread online from a Bundestag sponsored risk analysis, which has predictions of extremely high mortality rates",0,Fear,Generate panic by misconstruing current state of pandemic in Germany,Individual actor,General public,Internet,False reporting,"Coronavirus, Germany, risk analysis, Bundestag",A risk analysis conducted by the Bundestag in 2012 which analyzed a worst-case scenario of a general pandemic was dug up and recirculated alongside implications that the coronavirus would be extremely severe and result in astronomical mortality rates,Audrey
202,https://politics.gmw.cn/2020-03/13/content_33648332.htm,,,,,0,,,,,???????????????,13-Mar-20,6-Apr-20,China,Mandarin,,False cures and preventative measures,Messages were spread that the use of granite prevents infection of the coronavirus,1,Help,Spreads claims that granite will help prevent the coronavirus,Individual actor,General public,Social media,Fake remedy,"Coronavirus, granite",Messages were spread the granite prevents the coronavirus,Anne
203,https://ishare.ifeng.com/c/s/v002KvBVFcEoRgHpa7GJ2BpKEh--1Vy2ruBJyMJliAewiOZs__,,,,,0,https://ishare.ifeng.com/c/s/v002KvBVFcEoRgHpa7GJ2BpKEh--1Vy2ruBJyMJliAewiOZs__,,,,????????“3?16??????????”???,13-Mar-20,25-Apr-20,China,Mandarin,,Emergency responses,"Shandong Provincial Department of Education dismissed the rumor that students would enter school after March 16th
",1,False Hope,Suggests schools from Shandong Province will return to school on March 16,Individual actor,General public,"Social media, Wechat",False reporting,"Coronavirus, Shandong, school ",A message spread on social media that students from the Shandong Province will return to school on March 16 but authorities dismissed the claims,Anne
204,https://www.kuna.net.kw/ArticleDetails.aspx?id=2878014&language=ar#,,https://www.kuna.net.kw/ArticleDetails.aspx?id=2878014&language=ar#,,,0,,,,,????????: ?? ??? ????? ???? ???? ????? ??????? ??????? ??????? ???????,14-Mar-20,12-Apr-20,Kuwait,Arabic,,COVID-19 status of individuals,Rumors claimed that a prisoner has died of coronavirus ,0,Fear,Spread false claims about coronavirus spreading in prisons,Individual actor,General Public,Social Media,False reporting,"Coronavirus, Kuwait, Prisoner, death",Rumors circulating on social media claimed that a prisoner was infected with coronavirus and died. The Ministry of Interior denied the claim ,Alaa
205,https://euvsdisinfo.eu/report/coronavirus-was-created-in-the-laboratory/,,,,,0,https://armeniasputnik.am/world/20200314/22389220/koronavirusy-stextsvel-e-laboratoriayum-razmakan-pordzaget.html,,,,Coronavirus created in a laboratory,14-Mar-20,25-Mar-20,Armenia,Armenian,,Weaponization or design,Sputnik Armenia argues that the corona virus cannot occur in nature and suggests that an American lab based in Georgia may be the source; quotes an expert calling for investigations into the lab,0,Undermine target country institutions ,Promote a narrative that the US is behind the virus,State sponsors,Russia,Internet,Conspiracy,"Coronavirus, invented, Lugan Laboratory, US",US is likely behind the design of corona,Justinas
206,https://qz.com/1818606/alex-jones-ordered-to-stop-selling-fake-coronavirus-cures/,,,,,0,https://www.infowarsstore.com/super-blue-fluoride-free-toothpaste,,,,Alex Jones peddled a fake coronavirus cure that can turn people’s skin permanently blue,14-Mar-20,16-Mar-20,US,English,,False cures and preventative measures,Alex Jones selling toothpaste as a cure to COVID-19.,0,Profit,"Alex Jones saying he has a toothpaste to cure COVID-19, to profit.",Individual actor,Alex Jones,Website,Fake remedy,"Coronavirus, Alex Jones, toothpaste","Alex Jones selling ""nano-silver"" toothpaste to treat COVID-19, suggesting it is a ""Chinese Communist"" plot.",Jan
207,https://www.spiegel.de/gesundheit/diagnose/coronavirus-schuetzt-staendiges-wassertrinken-vor-einer-infektion-kettenbrief-im-check-a-305a7f9c-2dd9-4bfb-a8d1-e5e4485250e3,,,,,0,,,,,Schützt ständiges Wassertrinken vor einer Coronainfektion?,14-Mar-20,5-Apr-20,Germany,German,,False cures and preventative measures,Messages circulating via Whatsapp that drinking water every 15 minutes would prevent coronavirus,1,Help,Spread rumors that washing down the virus with water would prevent people from catching ill,Individual actor,General Public,Whatsapp,Fake remedy,"Coronavirus, Germany, Whatsapp, self-testing","Rumors spread through Whatsapp that drinking water would kill the virus, and that holding your breath can be used as a diagnostic test for coronavirus",Audrey
208,http://www.bjnews.com.cn/news/2020/03/14/703888.html,,,,,0,,,,,???????“????”?????????,14-Mar-20,6-Apr-20,China,Mandarin,,False cures and preventative measures,Messages were spread that injecting special plasma helps prevent the coronavirus,1,Help,Spread false rumors that injecting plasma helps cure the coronavirus,Individual actor,General Public,Social Media,False reporting,"Coronavirus, plasma, cure, injection","Rumors were spread the injecting a special plasma will help cure the virus, but Chinese authorities debunked the myth",Anne
209,https://ishare.ifeng.com/c/s/v002H977HjnHaA0zMb6J--vDw-_T5dy5vozFJyzEnEjOzysuI__,,,,,0,https://ishare.ifeng.com/c/s/v002H977HjnHaA0zMb6J--vDw-_T5dy5vozFJyzEnEjOzysuI__,,,,????????????????????,14-Mar-20,17-Apr-20,China,Mandarin,,Emergency responses,"Does Wuhan community use funeral home vehicles to transport group shopping expenses? Not true
",1,Fear,Suggests the Wuhan community uses funeral home vehicles to transport group shopping expenses,Individual actor,General public,"Social media, Weibo",False reporting,"Coronavirus, Wuhan, funeral homes, vehicles, transport, group shopping, expenses","Rumors claimed the Wuhan community uses funeral homes vehicles to transport group shopping expenses, but authorities refuted the claims",Anne
210,https://ishare.ifeng.com/c/s/v002KctHrwiEhpCL--7RvQd2OjVNwQgU8ZQoY6--blbC6Hp28__,,https://ishare.ifeng.com/c/s/v002KctHrwiEhpCL--7RvQd2OjVNwQgU8ZQoY6--blbC6Hp28__,,,0,https://ishare.ifeng.com/c/s/v002KctHrwiEhpCL--7RvQd2OjVNwQgU8ZQoY6--blbC6Hp28__,https://ishare.ifeng.com/c/s/v002KctHrwiEhpCL--7RvQd2OjVNwQgU8ZQoY6--blbC6Hp28__,https://ishare.ifeng.com/c/s/v002KctHrwiEhpCL--7RvQd2OjVNwQgU8ZQoY6--blbC6Hp28__,https://ishare.ifeng.com/c/s/v002KctHrwiEhpCL--7RvQd2OjVNwQgU8ZQoY6--blbC6Hp28__,???????????????????????,14-Mar-20,17-Apr-20,China,Mandarin,,COVID-19 status of individuals,"Some residents in Wuhan concealed their fevers and caused a family of five to be taken to hospital? Fake! 
",1,Fear,Suggests infected residents hid their disease and caused a family to be sick,Individual actor,General public,"Social media, Wechat, Weibo",False reporting,"Coronavirus, conceal, Wuhan, residents, fevers, family, hospital
",Rumors claimed Wuhan residents concealed their fevers and caused a family of five to go to the hospital,Anne
211,https://ishare.ifeng.com/c/s/v002cF5GDkdVuAuet7ZVhJnZzXeRAARixout7svfszaB59c__,,,,,0,https://ishare.ifeng.com/c/s/v002cF5GDkdVuAuet7ZVhJnZzXeRAARixout7svfszaB59c__,https://ishare.ifeng.com/c/s/v002cF5GDkdVuAuet7ZVhJnZzXeRAARixout7svfszaB59c__,,,???????????????4????????????,14-Mar-20,25-Apr-20,China,Mandarin,,COVID-19 status of individuals,"There are nearly 40,000 close contacts with Guo Moupeng from Zhengzhou, Henan who are now dead? All rumors",1,Fear,"Spreads message that nearly 40,000 people who came in contact with Guo Moupeng died ",Individual actor,General public,Social media,Conspiracy,"Coronavirus, Guo Moupeng, death","A message spread on social media that nearly 40,000 who came in contact with Guo Moupeng from Henan died but the rumors were false",Anne
212,https://cesti-elfove.cz/mimoradny-report-dezinfo-koronavirus/,,,,,0,https://www.vipnoviny.cz/kdo-stoji-za-vznikem-koronaviru-2019-ncov/,,,,Coronavirus epidemic - mapping outflow of Russian disinformation into Czech cyberspace,15-Mar-20,21-Mar-20,Czech Republic,Czech,,Weaponization or design,"American, US patent 2003",1,Undermine target country institutions ,Russia spread the story to blame the US for the virus and spark anti-US sentiment in the Czech cyberspace.,State sponsors,Russia ,Email,Conspiracy,"Coronavirus, Czech Republic, biological weapon, patent","Starting from an article on the website vipnoviny, an email has been circulating in the Czech cyberspace saying that the US government registered the coronavirus in 2003 and used it to attack China. Russia was behind the attack. ",Luca
