ID,Reported_On,Additional_Reporting,Retrieve_from_1,Retrieve_from_2,Retrieve_from_3,Twitter_Reference,Direct_Post_1,Direct_Post_2,Direct_Post_3,Direct_Post_4,Title,Publication_Date,Entry_Date,Country,Primary_Language,Secondary_Language,Main_Narrative,Narrative_Description,ChainMsg_or_Email,Motive,Motive_Description,Source,Source_Description,Distrib_Channel,Misinfo_Type,Key_Words,Summary,Coder
458,https://verafiles.org/articles/vera-files-fact-check-video-claiming-japans-pm-announced-cov,,https://verafiles.org/articles/vera-files-fact-check-video-claiming-japans-pm-announced-cov,,,0,,,,,VERA FILES FACT CHECK: Video claiming Japan’s PM announced COVID-19 ‘medicine’ MISLEADING,6-Apr-20,7-Apr-20,Philippines,Tagalog,,False cures and preventative measures,"Graphic circulated in the Philippines, claiming Japanese PM Abe had an anti-influenza drug ready",0,False Hope,Spreading false message of a cure for the sake of it,Individual actor,General public,"Facebook, Youtube",Fake remedy,"Coronavirus, Philippines, Avigan, Abe, Japan","Graphic and video circulating in the Philippines, claiming Japanese PM Abe already has a drug ready to combat COVID-19.",Jan
459,http://www.52hrtt.com/za/n/w/info/D1585909115759,,,,,0,,,,,????????????????????????,7-Apr-20,12-Apr-20,Spain,Cantonese,,COVID-19 status of individuals,Spanish-language newspaper El Pais claimed a Madrid man living on Azahi Road has the coronavirus,0,Fear,Falsely claims a Madrid man in Spain has the coronavirus,Individual actor,General public,WhatsApp,False reporting,"Coronavirus, Madrid, Azahin Road, El Pais, Spain","El Pais, a Spanish-language newspaper, claimed that rumors said a Madrid man living on the Azahi Road in Spain had the coronavirus, and the false claim was spread via WhatsApp",Anne
460,https://www.rappler.com/newsbreak/fact-check/257276-queen-elizabeth-quote-praising-duterte,,https://www.rappler.com/newsbreak/fact-check/257276-queen-elizabeth-quote-praising-duterte,,,0,,,,,FALSE: Queen Elizabeth II’s quote praising Duterte,7-Apr-20,7-Apr-20,Philippines,English,,Emergency responses,"Altered photo of Queen Elizabeth's address to the UK and Commonwealth, praising President Duterte.",0,Politics,"Trying to bolster Duterte's response, based on Queen Elizabeth's address",Individual actor,General public,Facebook,False reporting,"Coronavirus, Philippines, Duterte, Queen Elizabeth address","Altered photo of Queen Elizabeth's address, claiming she said Duterte was essentially doing a great job in responding to the crisis in the Philippines",Jan
461,https://www.altnews.in/disaster-management-act-does-not-prohibit-coronavirus-posts-on-social-media/,https://factcheck.afp.com/new-hoax-circulates-online-india-has-outlawed-social-media-posts-about-covid-19,https://www.altnews.in/disaster-management-act-does-not-prohibit-coronavirus-posts-on-social-media/,,,0,,,,,Disaster Management Act does not prohibit coronavirus posts on social media,7-Apr-20,14-Apr-20,India,English,,Emergency responses,"Disaster Management proclamation prevents people, who are not a government ministry, from posting news related to COVID-19 on social media",1,Fear,Scaring people into not forwarding or posting news related to COVID-19 on social media,Individual actor,General public,WhatsApp,Conspiracy,"Coronavirus, Disaster Management Act","WhatsApp forwards falsely claimed that according to the Disaster Management Act, enacted by the government in light of the COVID-19 crisis, it was a punishable offense to post or forward news or information related to the coronavirus",Kamya
462,https://observers.france24.com/fr/20200407-intox-fbi-saisi-masques-protection-synagogue-temple-juif-new-york,,https://observers.france24.com/fr/20200407-intox-fbi-saisi-masques-protection-synagogue-temple-juif-new-york,,,0,,,,,"Non, le FBI n'a pas saisi des masques de protection dans un ""temple juif"" de New York",7-Apr-20,13-Apr-20,France,French,,Other,"Claim the FBI has seized a big stock of masks in a ""Jewish temple"" in New York City",0,Politics,Discredit the Jewish community by accusing it of illegaly stocking masks in New York,Individual actor,"Facebook account ""Canal France Algérie Officiel""",Facebook,False reporting,"Coronavirus, Jewish, masks, stock, FBI, seize",Facebook posts claimed FBI had arrested several members of the Jewish community in New York for illegally stocking masks in a synagogue,Giorgio
463,https://www.lemonde.fr/les-decodeurs/article/2020/04/07/attention-la-carte-de-france-annoncant-des-dates-de-deconfinement-par-regions-est-un-faux_6035870_4355770.html,,https://www.lemonde.fr/les-decodeurs/article/2020/04/07/attention-la-carte-de-france-annoncant-des-dates-de-deconfinement-par-regions-est-un-faux_6035870_4355770.html,https://www.liberation.fr/checknews/2020/04/06/cette-carte-montrant-les-sorties-du-confinement-par-region-reprise-par-hanouna-est-fausse_1784387,,1,https://twitter.com/J_Rodrigues_Off/status/1247189046453035008,,,,Coronavirus : la carte de France annonçant des dates de déconfinement par régions est un faux,7-Apr-20,16-Apr-20,France,French,,Emergency responses,A document showing the dates for the end of the lockdown in the different French regions,1,Other,Spread a fake plan concerning the procedure to end the lockdown for the different regions of France,Individual actor,General public,"WhatsApp, Twitter, TV",False reporting,"Coronavirus, France, map, regions, confinement",A fake official document showing a map of France and indicating the dates for the end of the lockdown for the different regions circulated on several social media and was even shown on TV,Giorgio
464,"https://www.br.de/nachrichten/netzwelt/coronavirus-fakes-und-faktenchecks,Ros6PIg",,,,,1,,,,,Fake-Ticker: 100 Prozent Heilungsquote? Angaben sind unbestätigt,7-Apr-20,7-Apr-20,Germany,German,English,False cures and preventative measures,News newly circulating in Germany now of a US doctor claiming to have a cure for the coronavirus with a 100% success rate,0,Profit,"Likely wants to sell this ""cure"" for profit",Individual actor,"Vladimir Zelenko, New York doctor",Internet news sources,False reporting,"Coronavirus, cure, US, New York, Germany",News reached Germany (after circulation in the US) of a New York based doctor who claims to have a cure for the coronavirus with a 100% success rate,Audrey
465,"https://www.br.de/nachrichten/wissen/grippe-impfung-erhoeht-risiko-fuer-covid-19-nicht,RvU2py9",,,,,0,,,,,Grippe-Impfung erhöht Risiko für Covid-19 nicht!,7-Apr-20,7-Apr-20,Germany,German,,Nature of the virus,Rumors circulating that the flu shot increases your risk for coronavirus,0,Fear,Efforts to discredit the flu shot as something that can negatively impact someone at risk for coronavirus,Individual actor,General public,Internet,False reporting,"Coronavirus, flu shot, risk factors",Misunderstanding of original news source from UK likely led to rumors circulating about how the flu shot is detrimental and increases risk for coronavirus,Audrey
466,https://correctiv.org/faktencheck/2020/04/03/coronavirus-billy-six-filmt-angeblich-menschenleere-krankenhaeuser-ist-aber-am-falschen-ort,,,,,0,https://www.youtube.com/watch?v=TzTr_RjtgUk&feature=youtu.be&t=695,https://www.youtube.com/watch?v=Sfm1oXpvkTA&feature=youtu.be&t=411,https://www.youtube.com/watch?v=RKjJoWfRfpg&feature=youtu.be&t=53,,"Coronavirus: Nein, aktuelle PCR-Tests haben keine Fehlerquote von 30 bis 50 Prozent",7-Apr-20,13-Apr-20,Germany,German,,Other,Claims that PCR tests used to check for coronavirus give 30 to 50 percent false positives,0,Downplay Severity,"Try to undermine the legitimacy of a method used to test for the coronavirus, downplay the actual spread of the virus",Individual actor,"Claus Koehnlein, Heiko Schoening, Andreas Schlecht",Youtube,False reporting,"Coronavirus, Germany, PCR test",Three different Youtubers posted videos regarding the coronavirus which included claims about wildly high false positive rates for PCR tests,Audrey
467,https://www.tagesspiegel.de/themen/reportage/verschwoerungstheorien-zum-coronavirus-die-schaebigen-die-toedlichen-und-die-saudummen/25716306.html,,,,,0,,,,,"Die Zahlenfolge, die vor dem Virus schützt",7-Apr-20,24-Apr-20,Germany,German,Russian,False cures and preventative measures,Claims spread on the internet that writing a specific numeric code in public and private spaces can ward off the coronavirus,0,Profit,"Generate discussion about this seeming supernatural cure, draw attention to the psychic who is pushing these claims",Individual actor,"Woman from Fulda, general public",Internet,Fake remedy,"Coronavirus, Germany, Fulda, psychic, code, numbers","A woman from Fulda claims to have a numeric code with powers to ward off the coronavirus, advises people to write the numbers everywhere - code disputed by another psychic from Russia with a different code.",Audrey
468,https://www.tagesspiegel.de/themen/reportage/verschwoerungstheorien-zum-coronavirus-die-schaebigen-die-toedlichen-und-die-saudummen/25716306.html,,,,,0,,,,,„Es geht in Richtung 5. Dimension“,7-Apr-20,24-Apr-20,Germany,German,,Nature of the virus,"Claims believed by certain communities that the coronavirus was created by good forces to overcome bad dictators/politicians/rulers and Satanists, etc",0,Help,Apparent genuine belief that accepting the pandemic means positive change for the world,Individual actor,"General public, Bruno Würtenberger",Internet,Conspiracy,"Coronavirus, Germany, Satanism, Illuminati, new world order",Bruno Würtenberger and members of similar communities pushing their belief that the coronavirus is a tool from good forces who have come to correct the evil in the world,Audrey
469,https://www.tagesspiegel.de/themen/reportage/verschwoerungstheorien-zum-coronavirus-die-schaebigen-die-toedlichen-und-die-saudummen/25716306.html,,,,,0,,,,,Gefolterte Kinder für junges Aussehen,7-Apr-20,24-Apr-20,Germany,German,,COVID-19 status of individuals,Claims spread that the hospital ship used to treat coronavirus is actually a cover for hoarding kidnapped children and sacrificing them,0,Fear,Generate paranoia and cause people to question the intentions of people in power or the existence of secret groups of Satanists,Individual actor,"Kollegah, Xavier Naidoo, general public","Youtube, internet",Conspiracy,"Coronavirus, Germany, Xavier Naidoo, Kollegah, USNS Comfort",German rappers Kollegah and Xavier Naidoo are just a few of the people who believe in the myth that the hospital ship in NYC actually is holding tortured children instead of coronavirus patients - children are used by Hillary Clinton and other Satanists as sacrifices to stay young,Audrey
470,https://www.tagesspiegel.de/themen/reportage/verschwoerungstheorien-zum-coronavirus-die-schaebigen-die-toedlichen-und-die-saudummen/25716306.html,,,,,0,,,,,Der Plan der Weißen Bruderschaft,7-Apr-20,24-Apr-20,"Germany, Switzerland",German,Swiss German,Nature of the virus,"Claims spread that a so-called supernatural ""white brotherhood"" released the coronavirus as a test-run to see how humanity can overcome unpredictable situations",0,Help,"Ambiguous, could be that the medium pushing this belief genuinely believes in the advice she's giving, or that she's just calling for attention (profit)",Individual actor,Swiss medium Nancy Holten,Youtube,Conspiracy,"Coronavirus, Switzerland, Nancy Holten, medium, White Brotherhood","Swiss medium Nancy Holten published a video on Youtube claiming that the ""White Brotherhood"" spoke to her and told her they started the coronavirus in order to test humanity",Audrey
471,https://www.tagesspiegel.de/themen/reportage/verschwoerungstheorien-zum-coronavirus-die-schaebigen-die-toedlichen-und-die-saudummen/25716306.html,,,,,0,,,,,Jesus hasst euch,7-Apr-20,24-Apr-20,Germany,German,,Nature of the virus,"Claims spread by religious figures that coronavirus is a result of Jesus being angry, potentially at the legalization of gay marriage",0,Other,Using the pandemic to preach extreme religious beliefs,Individual actor,"Archbishop of Berlin/Germany, Michael Arndt",Ambiguous,Conspiracy,"Coronavirus, Michael Arndt, Russian orthodox, Berlin, Germany, Jesus",Russian orthodox Archbishop of Berlin and Germany made claims that coronavirus resulted from Jesus' anger at the legalization of abortion/gay marriage,Audrey
472,https://www.tagesspiegel.de/themen/reportage/verschwoerungstheorien-zum-coronavirus-die-schaebigen-die-toedlichen-und-die-saudummen/25716306.html,,,,,0,,,,,Die geheime Verbindung zwischen Corona und Kobe Bryant,7-Apr-20,24-Apr-20,Germany,German,English,Nature of the virus,Claims spread that there is a connection between the spread of the coronavirus and the death of Kobe Bryant,0,Other,Generate speculation as to whether there is a deeper meaning behind the pandemic,Individual actor,General public,Ambiguous,Conspiracy,"Coronavirus, Kobe Bryant, Google translate","Claims from unknown sources spread that there is a connection between Kobe and corona; evidence includes the fact that if you translate Covid from Hebrew to English, you get Kobe",Audrey
473,https://www.tagesspiegel.de/themen/reportage/verschwoerungstheorien-zum-coronavirus-die-schaebigen-die-toedlichen-und-die-saudummen/25716306.html,,,,,0,,,,,Nostradamus hat es gewusst - oder wenigstens Madonna?,7-Apr-20,24-Apr-20,Ambiguous,German,French,Other,Claims spread that the 16th century French apothecary Nostradamus predicted the spread of the coronavirus,0,Other,Convince public that spread of the virus was not coincidental,Individual actor,General public,Ambiguous,Conspiracy,"Coronavirus, Nostradamus, conspiracy",Claims from unknown sources that the French apothecary Nostradamus predicted the spread of the coronavirus in 2020 specifically ,Audrey
474,https://www.altnews.in/hindi/prince-charless-coronavirus-wasnt-cured-with-ayurvedic-homeopathic-treatment/,,https://www.altnews.in/hindi/prince-charless-coronavirus-wasnt-cured-with-ayurvedic-homeopathic-treatment/,,,1,https://twitter.com/ManishTewari/status/1245210540353323009,https://twitter.com/ians_india/status/1245707264129892352,,,?????? ????? : ?????? ??????? ?? COVID-19 ??????? ?????????? ?? ?????????? ????? ?? ??? ????,7-Apr-20,7-Apr-20,India,Hindi,,False cures and preventative measures,Tweets by government parliamentarians claiming homeopathy as a cure for the coronavirus,0,Other,"Trying to claim that homeopathy is a legitimate cure for coronavirus, based on the false story that Prince Charles was cured of coronavirus",Political actor,Politicians Manish Tiwari and Shripad Naik,Twitter,Fake remedy,"Coronavirus, homeopathy, Prince Charles","Based on false information of Prince Charles being cured of the coronavirus through homeopathy, government officials adopted this narrative, both on Twitter and in press conferences",Kamya
475,https://www.open.online/2020/04/07/coronavirus-il-messaggio-whatsapp-sul-fantomatico-video-argentina-lo-sta-facendo-che-vi-hackera-il-cellulare/,,https://www.open.online/2020/04/07/coronavirus-il-messaggio-whatsapp-sul-fantomatico-video-argentina-lo-sta-facendo-che-vi-hackera-il-cellulare/,,,0,,,,,Coronavirus. Il messaggio Whatsapp sul fantomatico video «Argentina lo sta facendo» che vi «hackera» il cellulare,7-Apr-20,7-Apr-20,Italy,Italian,Spanish,Other,A video was shared on WhatsApp saying that the epidemic curve was about to flatten in Argentina,1,Profit,Effort to spread a video through which the hacker can hack the mobile phone and steal credentials  ,Individual actor,General public,WhatsApp,False reporting,"Coronavirus, video, Argentina, curva epidemica","A video was spread on WhatsApp saying it showed the video of the Argentinian epidemic curve flattening. However, it was an attempt to hack the mobile phone and take control of it.",Luca
476,https://www.buzzfeed.com/jp/kotahatachi/emergency-declaration-3,,https://www.buzzfeed.com/jp/kotahatachi/emergency-declaration-3,,,1,https://twitter.com/kikko_no_blog/status/1247012750686949376,,,,??????????????3??????????????…?,7-Apr-20,7-Apr-20,Japan,Japanese,,Emergency responses,Twitter user claiming that residents living in areas of states of emergency cannot leave their homes for three weeks,0,Other,Spread claim that public won't be able to leave their homes for three weeks ,Individual actor,User @kikko_no_blog on Twitter,Twitter,False reporting,"Coronavirus, Japan, three weeks, state of emergency, lockdown","A twitter user claimed that under the state of emergency, people cannot leave their homes for three weeks",Fumika
477,https://www.news24.jp/articles/2020/04/07/07621797.html,,,,,0,,,,,???”????”????????”??”?,7-Apr-20,12-Apr-20,Japan,Japanese,,COVID-19 status of individuals,"Claims that sick patient visited popular resturant in Ojiya, Niigata prefecture",1,Fear,"Spread fear that restaurant in Ojiya, Niigata prefecture is unsafe",Individual actor,General Public,Social media,False reporting,"Coronavirus, Japan, Niigata, Ojiya, restaurant","Rumors spread that coronavirus infected people ate at restuarant in Ojiya, Niigata prefecture",Fumika
478,https://vp.fact.qq.com/article?id=5cb40c34167c45ad85863702f07a81c5,,https://vp.fact.qq.com/article?id=5cb40c34167c45ad85863702f07a81c5,,,0,,,,,???????????????????????,7-Apr-20,8-Apr-20,China,Mandarin,,Nature of the virus,A picture was sent on social media showing a microscopic image of Coronavirus particles covering the streets. ,1,Fear,Trying to alert public and stroke fear among the public to avoid going outside. ,Individual actor,General public,"Websites, social media ",Conspiracy,"Coronavirus, United States, advanced microscope, air",A picture circulated on social media showing how the United States used an advanced microscope and saw the virus in the air ,Anne
479,https://vp.fact.qq.com/article?id=347715b41b4769ccef3bf45adfa6fb38,,,,,1,,,,,BBC4?7????????????????,7-Apr-20,8-Apr-20,China,Mandarin,,COVID-19 status of individuals,Twitter user claiming how BBC said that on April 7 the British Prime Minister Boris died of coronavirus,0,Politics,Spreading claim that the British Prime Minister passed away ,Media,Fake account claiming to be BBC,Twitter,False reporting,"Coronavirus, BBC Breaking News, British Prime Minister, Boris Johnson, death, BBCbreaki",A fake account on Twitter claiming to be BBC Breaking News said that British Prime Minister Boris Johnson passed away due to the coronavirus,Anne
480,https://vp.fact.qq.com/article?id=021585b1cfb3458ca65f5236cf72c7db,,,,,0,,,,,???????????????????????,7-Apr-20,8-Apr-20,China,Mandarin,English,False cures and preventative measures,"Facebook post with the World Health Organization logo circulated in social media saying ""Stop eating baking goods! Never eat baked goods because it can be infected with coronavirus.""",1,Undermine target country institutions ,Spreading false news that baked goods are infected with coronavirus.,Media,Fake accounting claiming to be World Health Organization,Facebook,False reporting,"Coronavirus, World Health Organization, baked, goods, infected, stop, eating",A fake account on Facebook claiming to be World Health Organization said to stop eating baked goods to prevent coronavirus,Anne
481,https://k.sina.com.cn/article_1905653985_7195f8e101900peik.html?from=society,,,,,0,,,,,????“????”???“30????”????,7-Apr-20,11-Apr-20,China,Mandarin,,COVID-19 status of individuals,"Guangzhou rumors claimed there was a ""black thunder"" on the web and two black children were infected ",1,Fear,Instill fear that there are black individuals infected in China,Individual actor,General public,Social media,Conspiracy,"Coronavirus, black, thunder, web, infected",Rumors claimed black individuals in China were infected,Anne
482,https://www.rappler.com/newsbreak/fact-check/257283-photos-anakbayan-kilusang-mayo-uno-rallying-coronavirus-quarantine,,https://www.rappler.com/newsbreak/fact-check/257283-photos-anakbayan-kilusang-mayo-uno-rallying-coronavirus-quarantine,,,0,,,,,"FALSE: Photos of Anakbayan, KMU rallying during quarantine",7-Apr-20,7-Apr-20,Philippines,Tagalog,,Other,"Old photos resurfaced on Facebook, with users claiming leftist protest groups were using their Q-pass (quarantine pass) to protest against Duterte in the Philippines",0,Politics,"Trying to weaken and discredit leftist groups in the Philippines, claiming they were breaking quarantine laws.",Individual actor,General public,Facebook,False reporting,"Coronavirus, Philippines, Anakbayan, Kilusang Mayo Uno (KMU), Luzon, leftist groups",Photos from over a month ago claiming Filipino leftist groups Anakbayan and Kilusang Mayo Uno (KMU) were using their quarantine-passes to protest in the middle of the pandemic. ,Jan
483,https://www.facebook.com/ShekibLodin/photos/a.492411757562097/1837472943055965/?type=3&theater,,,,,0,Shekib Lodin ?. ?????,,,,?????? ????? ????? ?? ?????? ??? ?????? ???,8-Apr-20,12-Apr-20,Afghanistan,Farsi,,Other,Why Cornona Viros don't covered China Capital ,,Undermine target country institutions ,This person analysed and think if Corona can go to all the world than why it dont cover china capital it self (this means that is china virous),Individual actor,Facebook,Facebook,Conspiracy,"Coronavirus, Chinees, made, virus ",This analyzed by one person and he think becuase COVID-19 was not covered all chinal but that covered all the world that's why this is chinees made virus,Shahim
484,https://observers.france24.com/fr/20200408-test-vaccin-covid-19-enfants-senegal-video-coronavirus,,,,,0,https://www.facebook.com/fidele.tchuinkwa/videos/3886356698073548/,https://www.facebook.com/groups/260143917975332/permalink/536363667020021/,,,Un test du vaccin contre le Covid-19 sur des enfants au Sénégal ? Que montre vraiment cette vidéo ?,8-Apr-20,13-Apr-20,"France, Senegal",French,Wolof,Other,Claim that a vaccine for coronavirus is being tested on children in Senegal,1,Fear,Spread the fear that children in Senegal are being used as test subjects for an experimental coronavirus vaccine,Individual actor,Facebook accounts,"Facebook, WhatsApp",False reporting,"Coronavirus, Senegal, vaccine, children, test","A video circulating on Facebook falsely claims that a men was trying to test a coronavirus vaccine on children in Pikine, Senegal",Giorgio
485,https://correctiv.org/faktencheck/2020/04/08/nein-covid-19-ist-anders-als-von-rolf-kron-behauptet-nicht-nur-ein-harmloser-schnupfen,,,,,0,,,,,"Nein, Covid-19 ist, anders als von Rolf Kron behauptet, nicht nur ein harmloser Schnupfen",8-Apr-20,13-Apr-20,Germany,German,,Nature of the virus,"Claims that the coronavirus is overhyped and completely harmless, that the death count is completely normal for a minor virus",0,Downplay Severity,"Criticize the ""hype"" in Germany surrounding coronavirus, condemn general public for ""overreacting""",Individual actor,Rolf Kron,Youtube,False reporting,"Coronavirus, anti-vaxxer, Germany, homeopath","Anti-vaxxer/homeopath Rolf Kron makes public a Youtube video in which he claims the coronavirus is harmless, overhyped, and that the death count is not concerning",Audrey
486,https://infact.press/2020/04/post-5329/,,,,,0,https://www.asahi.com/articles/ASN424D52N42ULBJ003.html?ref=tw_asahi,,,,[????FactCheck] ???? WHO?????????????????????? ??????????,8-Apr-20,8-Apr-20,Japan,Japanese,,Other,Asahi Shinbun published a misleading story stating that the WHO does not recommend cloth masks under any circumstances,0,Other,Spread misleading claim that the WHO does not recommend cloth masks,Media,Asahi Shinbun ,Asahi Shinbun's website and social media accounts,False reporting,"Coronavirus, Japan, mask, cloth, masks, WHO, World Health Organization, Asahi Shinbun","Asahi Shinbun published a story claiming that the WHO does not recommend cloth masks under any circumstances. However, that statement was part of a larger document that had recommendations specifically for healthcare professionals. ",Fumika
487,https://infact.press/2020/04/post-5384/,,,,,1,https://twitter.com/JPYlTqpLzb65rdX/status/1238097741709901825?ref_src=twsrc%5Etfw%7Ctwcamp%5Etweetembed%7Ctwterm%5E1238097741709901825%7Ctwgr%5E393535353b636f6e74726f6c&ref_url=https%3A%2F%2Finfact.press%2F2020%2F04%2Fpost-5384%2F,,,,[????FactCheck] ?????????????????????????????,8-Apr-20,8-Apr-20,Japan,Japanese,,Nature of the virus,Claim that Taiwanese TV show said many people with coronavirus suffer from fibrosis in the lungs and the survival rate is lower than lung cancer,0,Fear,Spread claim that coronavirus causes fibrosis in lungs and has death rate lower than lung cancer,Individual actor,Twitter user @JPYlTqpLzb65rdX,Twitter,False reporting,"Coronavirus, Japan, Taiwanese, Taiwan, Television, fibrosis, lung, lung cancer",A twitter account posted a screenshot from a Taiwanese television show falsely claiming the show reported coronavirus causes fibrosis and has a death rate lower than lung cancer,Fumika
488,https://www.okinawatimes.co.jp/articles/-/557817,,,,,1,,,,,?????????????????????????????????????????????????WEB???,8-Apr-20,10-Apr-20,Japan,Japanese,,Emergency responses,Tweets claiming that flights to Okinawa are fully booked,0,Fear,Spread panic that flights to Okinawa are fully booked,Individual actor,General public,Twitter,False reporting,"Coronavirus, Japan, Okinawa, flights, booked",Tweets circulating that flights to Okinawa are fully booked due to the declaration of state of emergency,Fumika
489,http://www.kepu.gov.cn/www/article/dtxw/1c9e7ff99c2f49d8b99198e5abe82831,,http://www.kepu.gov.cn/www/article/dtxw/1c9e7ff99c2f49d8b99198e5abe82831,,,0,,,,,???? | 14.7%?????????????????????????????,8-Apr-20,11-Apr-20,China,Mandarin,,Nature of the virus,14.7% of Wuhan felines were infected with the coronavirus,1,Fear,Instill fear that 14.7% Wuhan felines were infected with the coronavirus,Individual actor,General public,Social media,Conspiracy,"Coronavirus, felines, Wuhan",Rumors on social media claimed that 14.7% felines in Wuhan were infected with the coronavirus,Anne
